{
  "artifact_id": "CTX-SNAPSHOT-60806B57F8C2C1B3E8AA059428C0FAD2D1629DD06B4E3A402F476497E4038A2C",
  "artifact_type": "context-snapshot",
  "content": {
    "as_of": "2026-07-31T00:00:00Z",
    "budget_bytes": 65536,
    "candidate": {
      "git_head": "bbbbbbbbbbbbbbbbbbbbbbbbbbbbbbbbbbbbbbbb",
      "repository_digest": "CCCCCCCCCCCCCCCCCCCCCCCCCCCCCCCCCCCCCCCCCCCCCCCCCCCCCCCCCCCCCCCC",
      "source_spec_sha256": "050EA855693A9DD43303872934824E4B116A9210CECBD3CAA6F24F9EB9823FF4"
    },
    "context_bytes": 3643,
    "edges": [
      {
        "edge_id": "CTX-EDGE-00A00FE1BE1AD74FEEBF4D9E978AA39D341EB7D4B4A7BD58C6C01FE4AE7098A4",
        "edge_type": "verifies",
        "provenance": {
          "producer": "repository",
          "recorded_by": "M5-CONTEXT-INTEGRITY",
          "references": [
            {
              "path": "examples/m5-context/sources/accepted-contract.md",
              "sha256": "D8A56B88F3DADD861F4CEF7535C760D3BA794AB24DC7ECCFD16FDA6548C182B9"
            }
          ]
        },
        "source_node_id": "CTX-NODE-56D84380E522C62FC0B2411AD045A359AB2870078A9512850FA457F579190B49",
        "target_node_id": "CTX-NODE-CC3BAB26EB0DFBF46B4A91F502AC3C31E214573485EA9562B2F562AF3CD5F17C"
      },
      {
        "edge_id": "CTX-EDGE-03867DC2256A88F3D60FA32B872D26714D2797EDF077BD21B3F54356F915BDF3",
        "edge_type": "references",
        "provenance": {
          "producer": "repository",
          "recorded_by": "M5-CONTEXT-INTEGRITY",
          "references": [
            {
              "path": "examples/m5-context/sources/specification.md",
              "sha256": "050EA855693A9DD43303872934824E4B116A9210CECBD3CAA6F24F9EB9823FF4"
            }
          ]
        },
        "source_node_id": "CTX-NODE-CC3BAB26EB0DFBF46B4A91F502AC3C31E214573485EA9562B2F562AF3CD5F17C",
        "target_node_id": "CTX-NODE-595683BB6C6EB82812B16CF16AD66F06ECDC3B2CCE085D8279C7DAE07C64E84E"
      }
    ],
    "excluded": [],
    "graph_id": "CTX-GRAPH-D1FC9F96691D7B947FF3CAD08B27336C8E7C305F27E3A908B265D6A5CED96096",
    "nodes": [
      {
        "authority": "accepted-public-contract",
        "freshness": {
          "kind": "candidate-bound",
          "observed_at": null,
          "valid_until": null
        },
        "identifiers": [
          "M5-D1"
        ],
        "kind": "decision",
        "labels": [
          "contract",
          "identity"
        ],
        "locator": {
          "line_end": 3,
          "line_start": 1,
          "path": "examples/m5-context/sources/accepted-contract.md",
          "root_scope": "repository",
          "sha256": "D8A56B88F3DADD861F4CEF7535C760D3BA794AB24DC7ECCFD16FDA6548C182B9"
        },
        "node_id": "CTX-NODE-56D84380E522C62FC0B2411AD045A359AB2870078A9512850FA457F579190B49",
        "provenance": {
          "producer": "repository",
          "recorded_by": "M5-CONTEXT-INTEGRITY",
          "references": [
            {
              "path": "examples/m5-context/sources/accepted-contract.md",
              "sha256": "D8A56B88F3DADD861F4CEF7535C760D3BA794AB24DC7ECCFD16FDA6548C182B9"
            }
          ]
        },
        "required": false,
        "sensitivity": "public",
        "source_id": "CTX-SOURCE-972BE98E396BD4D8E340A294901D53C1E5815B30A023C8AA28D584E62DA2E30D",
        "text": "# Accepted contract\n\nContext snapshots are exact.\n",
        "text_sha256": "D8A56B88F3DADD861F4CEF7535C760D3BA794AB24DC7ECCFD16FDA6548C182B9",
        "title": "Accepted Context contract"
      },
      {
        "authority": "verified-evidence",
        "freshness": {
          "kind": "candidate-bound",
          "observed_at": null,
          "valid_until": null
        },
        "identifiers": [
          "EV-M5-PUBLIC"
        ],
        "kind": "evidence",
        "labels": [
          "evidence",
          "pass"
        ],
        "locator": {
          "line_end": 1,
          "line_start": 1,
          "path": "examples/m5-context/sources/verified-evidence.txt",
          "root_scope": "repository",
          "sha256": "4DE4993348334AA8952BEC7496EA8E0521ED0C992468893FC35A58B492B55767"
        },
        "node_id": "CTX-NODE-595683BB6C6EB82812B16CF16AD66F06ECDC3B2CCE085D8279C7DAE07C64E84E",
        "provenance": {
          "producer": "repository",
          "recorded_by": "M5-CONTEXT-INTEGRITY",
          "references": [
            {
              "path": "examples/m5-context/sources/verified-evidence.txt",
              "sha256": "4DE4993348334AA8952BEC7496EA8E0521ED0C992468893FC35A58B492B55767"
            }
          ]
        },
        "required": false,
        "sensitivity": "public",
        "source_id": "CTX-SOURCE-5512965B631295B53D4B600D061747CB28CBAA7D11B6A2942BDA8219FBCDC8EE",
        "text": "PASS: public fixture evidence is verified.\n",
        "text_sha256": "4DE4993348334AA8952BEC7496EA8E0521ED0C992468893FC35A58B492B55767",
        "title": "Verified public evidence"
      },
      {
        "authority": "canonical-specification",
        "freshness": {
          "kind": "candidate-bound",
          "observed_at": null,
          "valid_until": null
        },
        "identifiers": [
          "FR-M5-001"
        ],
        "kind": "specification",
        "labels": [
          "context",
          "must"
        ],
        "locator": {
          "line_end": 3,
          "line_start": 1,
          "path": "examples/m5-context/sources/specification.md",
          "root_scope": "repository",
          "sha256": "050EA855693A9DD43303872934824E4B116A9210CECBD3CAA6F24F9EB9823FF4"
        },
        "node_id": "CTX-NODE-CC3BAB26EB0DFBF46B4A91F502AC3C31E214573485EA9562B2F562AF3CD5F17C",
        "provenance": {
          "producer": "repository",
          "recorded_by": "M5-CONTEXT-INTEGRITY",
          "references": [
            {
              "path": "examples/m5-context/sources/specification.md",
              "sha256": "050EA855693A9DD43303872934824E4B116A9210CECBD3CAA6F24F9EB9823FF4"
            }
          ]
        },
        "required": true,
        "sensitivity": "public",
        "source_id": "CTX-SOURCE-50CCB567B1EA07728A6E09C5C5D6823B53A709A1E1CCBFBE31E0596627B24D5C",
        "text": "# Specification\n\nThe framework must validate context.\n",
        "text_sha256": "050EA855693A9DD43303872934824E4B116A9210CECBD3CAA6F24F9EB9823FF4",
        "title": "Canonical specification"
      }
    ],
    "query_id": "CTX-QUERY-76204DB6D3EE80C6EE8998F1807311BFCA3437055632197008075364F0DABA91",
    "selected": [
      {
        "cost_bytes": 929,
        "node_id": "CTX-NODE-56D84380E522C62FC0B2411AD045A359AB2870078A9512850FA457F579190B49",
        "rank": {
          "authority_rank": 2,
          "graph_distance": 0,
          "lexical_score": 21,
          "node_id": "CTX-NODE-56D84380E522C62FC0B2411AD045A359AB2870078A9512850FA457F579190B49",
          "phase": 3,
          "sensitivity_rank": 0
        },
        "reasons": [
          "lexical"
        ]
      },
      {
        "cost_bytes": 917,
        "node_id": "CTX-NODE-595683BB6C6EB82812B16CF16AD66F06ECDC3B2CCE085D8279C7DAE07C64E84E",
        "rank": {
          "authority_rank": 3,
          "graph_distance": 1,
          "lexical_score": 4,
          "node_id": "CTX-NODE-595683BB6C6EB82812B16CF16AD66F06ECDC3B2CCE085D8279C7DAE07C64E84E",
          "phase": 1,
          "sensitivity_rank": 0
        },
        "reasons": [
          "graph",
          "lexical"
        ]
      },
      {
        "cost_bytes": 925,
        "node_id": "CTX-NODE-CC3BAB26EB0DFBF46B4A91F502AC3C31E214573485EA9562B2F562AF3CD5F17C",
        "rank": {
          "authority_rank": 1,
          "graph_distance": 0,
          "lexical_score": 14,
          "node_id": "CTX-NODE-CC3BAB26EB0DFBF46B4A91F502AC3C31E214573485EA9562B2F562AF3CD5F17C",
          "phase": 0,
          "sensitivity_rank": 0
        },
        "reasons": [
          "identifier",
          "lexical",
          "required-reference"
        ]
      }
    ],
    "selection_id": "CTX-SELECTION-3D7E2B0CCDD5C9E637505CBF13F434C4F8DE35100B22EAC4C0C0CC0C7313D5AC",
    "sensitivity": "public",
    "unresolved_contradiction_ids": []
  },
  "schema_version": "1.0"
}
